{
  "$schema": "https://json-schema.org/draft/2020-12/schema",
  "$id": "https://ai-assembly-line.local/contracts/task.schema.json",
  "title": "Task",
  "type": "object",
  "additionalProperties": false,
  "required": [
    "id",
    "title",
    "summary",
    "owner_role",
    "repo_target",
    "depends_on",
    "inputs",
    "outputs",
    "acceptance_criteria",
    "verification"
  ],
  "properties": {
    "id": { "type": "string", "pattern": "^[a-z0-9\\-]+$" },
    "title": { "type": "string", "minLength": 1 },
    "summary": { "type": "string", "minLength": 1 },
    "owner_role": { "type": "string", "minLength": 1 },
    "repo_target": { "type": "string", "minLength": 1 },
    "depends_on": { "type": "array", "items": { "type": "string" } },
    "inputs": { "type": "array", "items": { "type": "string" } },
    "outputs": { "type": "array", "items": { "type": "string" } },
    "acceptance_criteria": {
      "type": "array",
      "items": { "type": "string" },
      "minItems": 1
    },
    "verification": {
      "type": "array",
      "items": { "type": "string" },
      "minItems": 1
    },
    "risk_tags": {
      "type": "array",
      "items": { "type": "string" }
    },
    "notes": {
      "type": "string"
    }
  }
}
